<?xml version="1.0" encoding="ISO-8859-1"?>
<!DOCTYPE config SYSTEM "archive.dtd">
<config>
  <attr name="base">../Diakaesten</attr>
  <attr name="copy-exif">1</attr>
  <attr name="copy-org">0</attr>
  <attr name="create-copy">0</attr>
  <attr name="debug">1</attr>
  <attr name="dir">org</attr>
  <attr name="dtd">config/archive.dtd</attr>
  <attr name="entities">archive</attr>
  <attr name="imgtype">jpg</attr>
  <attr name="import-pattern">.*/uwe2/.*</attr>
  <attr name="import-since">2007</attr>
  <picture-attributes>
    <attr name="cam:CameraModelName">(.*:)?CameraModelName|model</attr>
    <attr name="cam:FocalLength">(.*:)?FocalLength</attr>
    <attr name="cam:FocalLengthIn35mmFormat">(.*:)?FocalLengthIn35mmFormat</attr>
    <attr name="cam:Lens">(.*:)?[Ll]ens</attr>
    <attr name="cam:LensID">(.*:)?[Ll]ensID|lens-id</attr>
    <attr name="cam:LensSpec">(.*:)?[Ll]ensSpec|lens-spec</attr>
    <attr name="cam:Make">(.*:)?Make|manufacturer</attr>
    <attr name="descr:Comment">(.*:)?[Cc]omment</attr>
    <attr name="descr:Keywords">(.*:)?[Kk]eywords</attr>
    <attr name="descr:Resource">(.*:)?[Rr]esource</attr>
    <attr name="descr:Subject">(.*:)?[Ss]ubject</attr>
    <attr name="descr:Subtitle">(.*:)?[Ss]ub[Tt]itle</attr>
    <attr name="descr:Title">(.*:)?[Tt]itle</attr>
    <attr name="descr:UserComment">(.*:)?UserComment|user-comment</attr>
    <attr name="exif:Aperture">(.*:)?Aperture</attr>
    <attr name="exif:ColorSpaceData">(.*:)?ColorSpaceData|color-space</attr>
    <attr name="exif:Contrast">(.*:)?[Cc]ontrast</attr>
    <attr name="exif:CreateDate">(.*:)?CreateDate|date-and-time</attr>
    <attr name="exif:DateTimeOriginal">(.*:)?DateTimeOriginal|date-and-time-original</attr>
    <attr name="exif:ExposureCompensation">(.*:)?ExposureCompensation|exposure-bias|exposure-compensation</attr>
    <attr name="exif:ExposureMode">(.*:)?ExposureMode|exposure-mode</attr>
    <attr name="exif:ExposureProgram">(.*:)?ExposureProgram|exposure-program</attr>
    <attr name="exif:ExposureTime">(.*:)?ExposureTime|exposure-time</attr>
    <attr name="exif:Flash">(.*:)?[Ff]lash</attr>
    <attr name="exif:FlashSetting">(.*:)?[Ff]lash-?[Ss]etting</attr>
    <attr name="exif:FNumber">(.*:)?FNumber|fnumber</attr>
    <attr name="exif:FocalLength">(.*:)?FocalLength|focal-length</attr>
    <attr name="exif:FocalLengthIn35mmFormat">(.*:)?FocalLengthIn35mmFormat|focal-length-in-35mm</attr>
    <attr name="exif:FocusDistance">(.*:)?FocusDistance|focus-distance</attr>
    <attr name="exif:FocusMode">(.*:)?FocusMode|focus-mode</attr>
    <attr name="exif:ImageSize">(.*:)?ImageSize|geometry</attr>
    <attr name="exif:ISO">(.*:)?ISO|iso-setting</attr>
    <attr name="exif:MeteringMode">(.*:)?MeteringMode|metering-mode</attr>
    <attr name="exif:Quality">(.*:)?[Qq]uality</attr>
    <attr name="exif:Saturation">(.*:)?[Ss]aturation</attr>
    <attr name="exif:Sharpness">(.*:)?[Ss]harpness</attr>
    <attr name="exif:ShootingMode">(.*:)?ShootingMode|shooting-mode</attr>
    <attr name="exif:ShutterSpeed">(.*:)?ShutterSpeed|shutter-speed</attr>
    <attr name="exif:VibrationReduction">(.*:)?VibrationReduction|vibration-reduction</attr>
    <attr name="exif:WhiteBalance">(.*:)?WhiteBalance|white-balance</attr>
    <attr name="file:FileModificationDateTime">(.*:)?FileModificationDateTime|modified</attr>
    <attr name="file:FileSize">(.*:)?FileSize|file-size</attr>
    <attr name="file:RefOrig">(.*:)?RefOrig|ref-org</attr>
    <attr name="file:RefRaw">(.*:)?RefRaw|ref-raw</attr>
    <attr name="file:RefXmp">(.*:)?RefXmp|ref-xmp</attr>
    <attr name="show:Duration">(.*:)?[Dd]uration</attr>
  </picture-attributes>
  <layout id="1024x768-css" type="html-css">
    <attr name="css-file">config/album-1024x768.css</attr>
    <attr name="dictionary">
      <attr name="title">Titel</attr>
      <attr name="subtitle">Untertitel</attr>
      <attr name="descr">Beschreibung</attr>
      <attr name="comment">Kommentar</attr>
      <attr name="resource">Weitere Infos</attr>
      <attr name="maps">Karten</attr>
      <attr name="photographer">Fotograf</attr>
      <attr name="author">Autor</attr>
      <attr name="designer">Designer</attr>
      <attr name="date-and-time">Datum</attr>
      <attr name="exposure-time">Belichtungszeit</attr>
      <attr name="fnumber">Blende</attr>
      <attr name="focal-length">Brennweite</attr>
      <attr name="focal-length-in-35mm">Brennweite in 35mm</attr>
      <attr name="exposure-program">Aufnahmebetriebsart</attr>
      <attr name="exposure-mode">Belichtung</attr>
      <attr name="exposure-bias">Belichtungskorrektur</attr>
      <attr name="metering-mode">Belichtungsmessung</attr>
      <attr name="iso-setting">ISO Empfindlichkeit</attr>
      <attr name="quality">Aufnamequalit‰t</attr>
      <attr name="color-space">Farbraum</attr>
      <attr name="lens">Objektiv</attr>
      <attr name="lens-id">Objektiv (Modell)</attr>
      <attr name="focus-mode">Scharfeinstellung</attr>
      <attr name="shooting-mode">Aufnahmemodus</attr>
      <attr name="white-balance">Weiﬂabgleich</attr>
      <attr name="flash">Blitz</attr>
      <attr name="flash-setting">Blitzeinstellung</attr>
      <attr name="focus-mode">Scharfeinstellung</attr>
      <attr name="white-balance">Weiﬂabgleich</attr>
      <attr name="model">Kamera</attr>
      <attr name="ref-org">Bilddatei</attr>
      <attr name="ref-raw">Bilddatei (raw)</attr>
      <attr name="geometry">Geometrie</attr>
      <attr name="file-size">Bildateigrˆﬂe</attr>
      <attr name="modified">Datum (Bilddatei)</attr>
      <attr name="af-d-or-af-s-lens">AF-D oder AF-S Objektiv</attr>
      <attr name="aperture-priority">Zeitautomatik</attr>
      <attr name="aperture-priority-ae">Blendenvorwahl</attr>
      <attr name="auto-exposure">Automatik</attr>
      <attr name="auto-white-balance">Automatischer Weiﬂabgleich</attr>
      <attr name="center-weighted-average">Mittenzentriertes gewichtetes Mittel</attr>
      <attr name="continuous">Serie</attr>
      <attr name="continuous-exposure-bracketing">Belichtungsreihe</attr>
      <attr name="fine">jpg (hoch)</attr>
      <attr name="fired-return-detected">Mit Blitz</attr>
      <attr name="flash-did-not-fire-auto-mode">Kein Blitz</attr>
      <attr name="flash-did-not-fire">Kein Blitz</attr>
      <attr name="full-auto">Voll automatisch</attr>
      <attr name="manual-exposure">Manuell</attr>
      <attr name="manual">Manuell</attr>
      <attr name="manual-white-balance">Manueller Weiﬂabgleich</attr>
      <attr name="multi-segment">Multi-Segment</attr>
      <attr name="no-flash">Kein Blitz</attr>
      <attr name="normal">Normal</attr>
      <attr name="off">Aus</attr>
      <attr name="normal-program">Multiprogrammautomatik</attr>
      <attr name="pattern">Matrixmessung</attr>
      <attr name="program-ae">Programm-Automatik</attr>
      <attr name="raw">raw</attr>
      <attr name="s-rgb">sRGB</attr>
      <attr name="single-frame">Einzelaufnahme</attr>
      <attr name="single-frame-exposure-bracketing">Einzelaufnahme, Belichtungsreihe</attr>
      <attr name="strobe-return-light-detected">Mit Blitzlicht</attr>
      <attr name="shutter-priority">Blendenautomatik</attr>
      <attr name="uncalibrated">Unkalibriert</attr>
    </attr>
    <attr name="duration">7000</attr>
    <attr name="geometry">1024x768</attr>
    <attr name="javascript-file">config/album.js</attr>
    <page type="album">
      <attr name="dir">100x75</attr>
      <attr name="dir2">100x75</attr>
      <attr name="geometry">100x75</attr>
      <attr name="geometry2">50x37</attr>
      <attr name="icons-per-row">9</attr>
      <attr name="template">config/album-template.xml</attr>
    </page>
    <page type="picture">
      <attr name="dir">1024x768</attr>
      <attr name="geometry">1024x768</attr>
      <attr name="template">config/picture-template.xml</attr>
    </page>
  </layout>
  <layout id="html-1024x768" type="html-css2">
    <attr name="duration">7000</attr>
    <attr name="geometry">1024x768</attr>
    <page type="album">
      <attr name="dir">100x75</attr>
      <attr name="dir2">100x75</attr>
      <attr name="geometry">100x75</attr>
      <attr name="geometry2">50x37</attr>
      <attr name="icons-per-row">9</attr>
      <attr name="template">config/template-album.xml</attr>
    </page>
    <page type="picture">
      <attr name="dir">1024x768</attr>
      <attr name="geometry">1024x768</attr>
      <attr name="template">config/template-picture.xml</attr>
    </page>
  </layout>
  <size>
    <attr name="dir">1600x1200</attr>
    <attr name="geometry">1600x1200</attr>
    <attr name="aspect-ratio">pad</attr>
  </size>
  <size>
    <attr name="dir">1024x768</attr>
    <attr name="geometry">1024x768</attr>
    <attr name="aspect-ratio">pad</attr>
  </size>
  <size>
    <attr name="dir">100x75</attr>
    <attr name="geometry">100x75</attr>
    <attr name="aspect-ratio">fix</attr>
  </size>
  <size>
    <attr name="dir">100x100</attr>
    <attr name="geometry">100x100</attr>
    <attr name="aspect-ratio">pad</attr>
  </size>
</config>

